[
  {
    "id": "kstartup-178896",
    "name_ko": "2026년 모두의 창업 글로벌 재외국민 프로그램 참여자 모집",
    "name_en": "Everyone's Startup Global: Overseas Korean Nationals Program (2026)",
    "agency_ko": "창업진흥원",
    "agency_en": "KISED (Korea Institute of Startup & Entrepreneurship Development)",
    "ministry_ko": "중소벤처기업부",
    "category_ko": "글로벌",
    "announcement_no": "제2026-505호",
    "application_start": "2026-08-12T19:00:00+09:00",
    "application_deadline": "2026-09-14T18:00:00+09:00",
    "timezone": "Asia/Seoul",
    "eligibility_ko": "한국 국적을 보유하고 해외에 거주 중인 유학생 등 예비창업자 또는 업력 7년 이내 해외 진출 창업기업",
    "support_ko": "멘토링·세미나, 현지 보육프로그램, 창업 활동비 지원",
    "source_name": "K-Startup",
    "source_url": "https://www.k-startup.go.kr/web/contents/bizpbanc-ongoing.do?pbancClssCd=PBC010&schM=view&pbancSn=178896",
    "verified_at": "2026-09-10"
  },
  {
    "id": "kstartup-178952",
    "name_ko": "「모두의 창업 프로젝트」통합 모집공고 2차",
    "name_en": "Everyone's Startup Project: Open Call (2nd round)",
    "agency_ko": "창업진흥원",
    "agency_en": "KISED (Korea Institute of Startup & Entrepreneurship Development)",
    "ministry_ko": "중소벤처기업부",
    "category_ko": "사업화",
    "announcement_no": "제2026-511호",
    "application_start": "2026-08-20T09:00:00+09:00",
    "application_deadline": "2026-09-17T16:00:00+09:00",
    "timezone": "Asia/Seoul",
    "eligibility_ko": "혁신적인 아이디어를 보유한 전 국민 누구나 (단, 공고문 내 신청자격 참고)",
    "support_ko": "1라운드 창업활동자금 200만원 + AI솔루션 지원, 2라운드 MVP 제작비 최대 2,000만원 내 차등지원 + GPU 지원 + 멘토링",
    "source_name": "K-Startup",
    "source_url": "https://www.k-startup.go.kr/web/contents/bizpbanc-ongoing.do?pbancClssCd=PBC010&schM=view&pbancSn=178952",
    "verified_at": "2026-09-10"
  },
  {
    "id": "kstartup-179192",
    "name_ko": "베트남 테크페스트(TECHFEST 2026) K-스타트업 통합관 참가기업 모집",
    "name_en": "TECHFEST Vietnam 2026 K-Startup Pavilion: Exhibitor Recruitment",
    "agency_ko": "창업진흥원",
    "agency_en": "KISED (Korea Institute of Startup & Entrepreneurship Development)",
    "ministry_ko": null,
    "category_ko": "글로벌",
    "announcement_no": "제2026-081호",
    "application_start": "2026-09-10T10:00:00+09:00",
    "application_deadline": "2026-09-17T16:00:00+09:00",
    "timezone": "Asia/Seoul",
    "eligibility_ko": "공고일 기준 업력 7년 이내 창업기업(신산업 창업분야 해당 시 10년 이내). 2022년 이후 창업진흥원 해외전시회 참가 2회 이상 기업 제외",
    "support_ko": "전시부스, 전시마케팅, IR컨설팅, 베트남 바이어·투자자 매칭, 항공·숙박비 최대 150만원",
    "source_name": "K-Startup",
    "source_url": "https://www.k-startup.go.kr/web/contents/bizpbanc-ongoing.do?pbancClssCd=PBC010&schM=view&pbancSn=179192",
    "verified_at": "2026-09-10"
  },
  {
    "id": "kstartup-178981",
    "name_ko": "2026년 제3차 대전 팁스타운 입주기업 모집",
    "name_en": "Daejeon TIPS Town Resident Company Recruitment (3rd call, 2026)",
    "agency_ko": "창업진흥원",
    "agency_en": "KISED (Korea Institute of Startup & Entrepreneurship Development)",
    "ministry_ko": null,
    "category_ko": "시설·공간·보육",
    "announcement_no": "제2026-074호",
    "application_start": "2026-09-01T09:00:00+09:00",
    "application_deadline": "2026-09-28T16:00:00+09:00",
    "timezone": "Asia/Seoul",
    "eligibility_ko": "모집공고일(2026-08-31) 기준 창업 7년 이내 중소기업 대표자 (신산업 분야는 10년 이내)",
    "support_ko": "대전 팁스타운 독립실(7인실/9인실) 입주, 기본 가구 및 공용 인프라 제공",
    "source_name": "K-Startup",
    "source_url": "https://www.k-startup.go.kr/web/contents/bizpbanc-ongoing.do?pbancClssCd=PBC010&schM=view&pbancSn=178981",
    "verified_at": "2026-09-10"
  },
  {
    "id": "kstartup-176076",
    "name_ko": "2026년 팁스(TIPS) 창업기업 지원계획 수정 공고",
    "name_en": "TIPS (Tech Incubator Program for Startup Korea) 2026 Support Plan",
    "agency_ko": "창업진흥원",
    "agency_en": "KISED (Korea Institute of Startup & Entrepreneurship Development)",
    "ministry_ko": "중소벤처기업부",
    "category_ko": "사업화",
    "announcement_no": "제2026-188호",
    "application_start": "2026-03-19T09:00:00+09:00",
    "application_deadline": "2026-12-31T18:00:00+09:00",
    "timezone": "Asia/Seoul",
    "eligibility_ko": "팁스(R&D): 팁스 운영사의 투자·추천을 받은 (예비)창업기업. 딥테크팁스·연계사업은 공고문 자격요건 참조",
    "support_ko": "팁스 최대 8억원(24개월), 딥테크팁스 최대 15억원(36개월) 등 세부사업별 지원",
    "source_name": "K-Startup",
    "source_url": "https://www.k-startup.go.kr/web/contents/bizpbanc-ongoing.do?pbancClssCd=PBC010&schM=view&pbancSn=176076",
    "verified_at": "2026-09-10"
  },
  {
    "id": "kstartup-175783",
    "name_ko": "2026년 중앙부처 및 지자체 창업지원사업 통합공고",
    "name_en": "2026 Integrated Announcement of Central Government & Municipal Startup Support Programs",
    "agency_ko": "창업진흥원",
    "agency_en": "KISED (Korea Institute of Startup & Entrepreneurship Development)",
    "ministry_ko": "중소벤처기업부",
    "category_ko": "사업화",
    "announcement_no": null,
    "application_start": "2025-12-19T13:00:00+09:00",
    "application_deadline": "2026-12-31T23:59:00+09:00",
    "timezone": "Asia/Seoul",
    "eligibility_ko": "각 지원사업 모집 공고문 참고",
    "support_ko": "중앙부처·지자체 창업지원사업 전체의 통합 안내 (세부 사업별 일정 상이)",
    "source_name": "K-Startup",
    "source_url": "https://www.k-startup.go.kr/web/contents/bizpbanc-ongoing.do?pbancClssCd=PBC010&schM=view&pbancSn=175783",
    "verified_at": "2026-09-10"
  },
  {
    "id": "kstartup-171419",
    "name_ko": "스타트업 코리아 특별비자 추천 신청",
    "name_en": "Startup Korea Special Visa: Recommendation Application",
    "agency_ko": "창업진흥원",
    "agency_en": "KISED (Korea Institute of Startup & Entrepreneurship Development)",
    "ministry_ko": "중소벤처기업부",
    "category_ko": "인력",
    "announcement_no": "제2024-592호",
    "application_start": "2024-12-03T18:00:00+09:00",
    "application_deadline": "2026-12-30T00:00:00+09:00",
    "timezone": "Asia/Seoul",
    "eligibility_ko": "한국 국적이 아닌 (예비)창업기업 대표. 중소기업창업지원법상 자격요건 충족 필요 (공고문 참조)",
    "support_ko": "스타트업 코리아 특별비자 추천서 발급",
    "source_name": "K-Startup",
    "source_url": "https://www.k-startup.go.kr/web/contents/bizpbanc-ongoing.do?pbancClssCd=PBC010&schM=view&pbancSn=171419",
    "verified_at": "2026-09-10"
  }
]
